{
  "$schema": "https://json-schema.org/draft/2020-12/schema",
  "$id": "urn:fair-v1:schema:occ-message-event:draft",
  "title": "FAIR-V1 OCC Message Event - DRAFT",
  "type": "object",
  "additionalProperties": false,
  "required": [
    "event_id",
    "run_id",
    "serialNumber",
    "seq",
    "protocol",
    "event_type",
    "event_time_us",
    "clock_domain",
    "service_id",
    "protocol_correlation",
    "dataset_schema_version",
    "event_source_layer"
  ],
  "properties": {
    "event_id": {
      "type": "string"
    },
    "run_id": {
      "type": "string"
    },
    "serialNumber": {
      "type": "string"
    },
    "seq": {
      "type": "integer",
      "minimum": 0,
      "maximum": 599
    },
    "protocol": {
      "enum": [
        "mqtt",
        "opcua",
        "dds"
      ]
    },
    "event_type": {
      "enum": [
        "occ_rx",
        "occ_tx"
      ],
      "description": "occ_rx = timestamp at entry to the FAIR application receive handler after the protocol stack delivers telemetry; occ_tx = timestamp immediately before the FAIR application invokes the protocol-specific echo submission/send operation. Exact API callsites are bound later by protocol source audit."
    },
    "event_time_us": {
      "type": "integer",
      "minimum": 0
    },
    "clock_domain": {
      "type": "string"
    },
    "service_id": {
      "type": "string",
      "description": "Must identify the FAIR application-echo service instance recorded in run metadata."
    },
    "protocol_correlation": {
      "type": [
        "object",
        "null"
      ],
      "additionalProperties": true
    },
    "dataset_schema_version": {
      "const": "1.0"
    },
    "event_source_layer": {
      "const": "fair_echo_application"
    }
  },
  "description": "Pi-side FAIR application-echo events. Events are generated by the FAIR echo application layer, not by treating broker/protocol-native acknowledgements as FAIR application echoes."
}
